{
  "auction_id": "auc_01H",
  "serve_token": "stk_3pQabcdef",
  "winner": {
    "agent_id": "ag_456",
    "clearing_price_cpx": "0.034",
    "preferred_unit": "CPA"
  },
  "render": {
    "label": "[Ad]",
    "title": "Pipedrive Starter",
    "body": "CRM for founders",
    "cta": "Start trial",
    "url": "https://admesh.click/stk_3pQabcdef"
  },
  "ttl_ms": 60000,
  "auth": { "sig": "sig789" }
}
